{
  "schema": "kinetic/gym/design-case@0.1",
  "case_id": "case-6f67d60006",
  "canonical_url": "https://neuemontreal.com/",
  "title": "PP Neue Montreal",
  "studio": "Pangram Pangram (foundry) / Demande Spéciale (site)",
  "status": "STUDIED",
  "provenance": {
    "discovered_via": "awwwards",
    "source_url": "https://www.awwwards.com/sites/pp-neue-montreal",
    "award": [
      { "body": "Awwwards", "type": "Site of the Day", "level": "SOTD", "year": 2026, "category": null, "jury_scores": { "overall": 7.41, "dev_award": 7.39 } }
    ],
    "fetched": "2026-08-22T02:40:00Z",
    "access_policy": "reference-site-observe-only",
    "site_robots_checked": false,
    "availability": "live",
    "archive_url": null
  },
  "surface": {
    "surface_types": ["editorial", "specimen", "product-story"],
    "k_level_estimate": "K3",
    "evidence": { "tag": "DIRECTLY-INSPECTED", "confidence": 0.9, "method": "live browser DOM/style/script probes" }
  },
  "analysis": {
    "layout": {
      "notes": {
        "concept": "typeface specimen framed as an 'Official Travel Guide' to Montreal — each specimen section is a city attraction",
        "structure": "20 named chapters in one long scroll (26 viewports): enveloppe (hero) -> story -> ligne-du-temps (timeline 2018-2026) -> caroussel-circulaire -> graisses-scroll (weights) -> coulers-attractions (10 attractions, each set in a different weight) -> letter-weights -> scroll-split-caracters -> ligatures-circles -> weights_charts -> languages (506) -> accents-bandeaux (240px accent rows) -> tickets -> point-circle-and-square -> pamphlet -> alternatives-versions",
        "flex": 340, "grid": 11, "sticky": 6, "fixed": 3,
        "distinctive": "French section ids as wayfinding; footer nav uses letter-spaced labels; attractions double as weight demos (content = specimen)"
      },
      "evidence": { "tag": "DIRECTLY-INSPECTED", "confidence": 0.95, "method": "DOM structure probe of main children + ids" }
    },
    "typography": {
      "notes": {
        "families": { "PP Neue Montreal Text Regular": 458, "PP Neue Montreal Text Variable": 303, "PP Neue Montreal Regular": 107, "PP Neue Montreal Bold": 85, "PP Neue Montreal Text Light Italic": 24 },
        "max_size_px": 240,
        "per_char_splitting": "206px per-character spans observed ('Already in Use, Worldwide!') — char-level animation rig",
        "system": "the product IS the typography: variable font used live, weight axis demonstrated by content, display vs text contrast is a named section",
        "letter_spacing": "section labels use spaced caps (rendered as 'S t o r y' in text)"
      },
      "evidence": { "tag": "DIRECTLY-INSPECTED", "confidence": 0.95, "method": "computed styles + font enumeration" }
    },
    "color": {
      "notes": {
        "palette": ["#000000 ink", "#F0E7D4 cream", "#1A1A1A near-black sections", "#FF4000 transit-orange accent", "#0000EE link blue (intentionally raw)"],
        "character": "cream paper ground with ink text; dark inversions for emphasis chapters; transit orange as wayfinding accent — matches Montreal metro signage theme"
      },
      "evidence": { "tag": "DIRECTLY-INSPECTED", "confidence": 0.95, "method": "computed style histogram" }
    },
    "motion": {
      "notes": {
        "platform": "Framer (framerusercontent script, framer-* classes) + Lottie (lottie-web 5.12.2 from cdnjs)",
        "scroll_model": "Framer scroll transforms: 692 transformed elements, 120 will-change, 23 CSS animations running at rest",
        "signature_effects": ["per-character split headline animation (scroll-split-caracters section)", "circular carousel (caroussel-circulaire)", "sticky weight chart", "timeline scrub (ligne-du-temps)", "ticket list reveals"],
        "no_gsap_no_webgl": "no GSAP/Three/Lenis globals — all motion via Framer runtime + Lottie + CSS"
      },
      "evidence": { "tag": "DIRECTLY-INSPECTED", "confidence": 0.9, "method": "script inventory + runtime style probe" }
    },
    "technology": {
      "observed": ["Framer hosting/runtime", "Lottie (lottie-web 5.12.2)", "variable font (PP Neue Montreal Text Variable)", "Cloudflare Insights", "Framer events script", "1 video element", "49 images"],
      "inferred": [
        { "claim": "Scroll-driven transforms are Framer's built-in effect system, not custom JS", "confidence": 0.85, "basis": "framer-* class naming + no animation library globals" },
        { "claim": "Lottie used for small illustrative animations (dots, ticket graphics)", "confidence": 0.6, "basis": "lottie_svg script loaded; no canvas elements" }
      ]
    },
    "performance": {
      "notes": { "images": 49, "will_change_count": 120, "risk": "120 will-change layers is heavy; Framer runtime overhead" },
      "evidence": { "tag": "DIRECTLY-INSPECTED", "confidence": 0.85, "method": "runtime probe" }
    },
    "accessibility": {
      "notes": { "headings": "semantic h1-h4 hierarchy present", "nav": "footer nav with anchor links to all chapters", "risk": "letter-spaced labels rendered as literal 'S t o r y' text may confuse screen readers; 240px specimen rows are content-free decoration" },
      "evidence": { "tag": "DIRECTLY-INSPECTED", "confidence": 0.75, "method": "DOM probe" }
    },
    "principles": [
      { "rule": "Concept-first specimen: the product demo is wrapped in a narrative metaphor (travel guide) so every section teaches AND entertains", "evidence_tag": "DIRECTLY-INSPECTED", "evidence_ref": "layout.notes.concept" },
      { "rule": "Content-as-specimen: attractions set in different weights make the weight axis tangible without a chart", "evidence_tag": "DIRECTLY-INSPECTED", "evidence_ref": "layout.notes.distinctive" },
      { "rule": "One long scroll with named chapters + footer wayfinding = editorial depth without routing complexity", "evidence_tag": "DIRECTLY-INSPECTED", "evidence_ref": "layout.notes.structure" },
      { "rule": "Per-character splitting at display scale turns headlines into motion moments (converges with Phase-1 thoughtful-focus finding)", "evidence_tag": "DIRECTLY-INSPECTED", "evidence_ref": "typography.notes.per_char_splitting" },
      { "rule": "Palette discipline: cream/ink + one transit accent; inversions mark chapter boundaries", "evidence_tag": "DIRECTLY-INSPECTED", "evidence_ref": "color.notes" }
    ],
    "inferences": [
      "Framer platform means V0 cannot copy implementation — must independently implement the chapter structure and scroll choreography in vanilla/KINETIC",
      "The 'raw link blue' (#0000EE) reads as an intentional anti-polish gesture matching the guide's utilitarian tone",
      "Variable font live manipulation (weight axis on scroll) is the core specimen mechanic"
    ],
    "anti_patterns": [
      { "issue": "120 will-change elements: layer-promotion excess risks memory pressure on low-end devices", "evidence_tag": "DIRECTLY-INSPECTED" },
      { "issue": "letter-spaced labels as literal spaced text ('S t o r y') harm screen-reader output", "evidence_tag": "DIRECTLY-INSPECTED" }
    ]
  },
  "figma": { "authorization": "none", "file_ref": null, "captured": null },
  "scores": {
    "external": { "awwwards_sotd": 7.41, "awwwards_dev": 7.39, "note": "weak prior only (doc 32)" },
    "automated": {}
  },
  "variant_run_ids": [],
  "taste_decision_ids": [],
  "promotion_history": [],
  "re_studies": []
}
